StrRef,Text
26496,Heh...
26497,Well...
26498,What a... charming fellow. Completely insane of course. Out of his mind. Blind as a bat. No idea what he was saying.
26503,Yes. Well.
26504,Let's... let's get going shall we?
26505,Um... I...
26733,"The... the locket is lovely, by the way. Thank you."
26961,Dermin? What are you doing back here? I am glad to see you; I had thought our friendship...
26963,What are you talking about?
26965,What? Such a thing has never been done!
26967,What do you mean?
26973,"Very well, Dermin. I will think on this."
26975,"Well, that was decidedly unpleasant, and more than I wish to worry about."
26979,Of... of course. It would be senseless. It does put a different light on things though. I will give this much thought indeed.
26980,I am going to do exactly what I said I would do. I am going to think about this. All of this.
26981,I have known him a long time. He was a mentor when I had none. I will think on this a long time. All of this.
27405,Stop!
27406,Do you see him? Ready yourself.
27407,Dermin! I would speak at you!
27409,"Shut up! I said I would speak AT you! This matter is finished! I will not acknowledge this again! If you press it, I will be forced to deal with you!"
27411,"Yes, actually, and you well know it! Galvarey was no more a Harper than a treant. His actions betrayed him, and all those that followed him!"
27412,"The garish Hold, his political agenda—he was merely using the weight of the Harper name to promote himself. Tell me: What did he offer you?"
27414,"Then I am better for it. Call me traitor, but I have followed the spirit of the Harpers. You are the traitor, and if the events were known, others would see!"
27416,"Of course not. Despite the ambushes, you will still be able to claim the moral high ground for your actions. What happened to you, Dermin? I do not know you."
27418,At the cost of the innocents. That is always the way.
27420,It certainly disrupted you. The innocents also include Harpers that have died thinking they were fighting for the right cause. Galvarey's cause. Your cause.
27422,"As was yours, though I suspect you have been gone for years."
27424,"Save it, Dermin. I have no more guilt about facing you or any other sent on this fool's crusade. You are the betrayers, not I. I know this in my heart."
27426,"I did not wish to do this. I did not. We are in the right, <CHARNAME>, but why does it still hurt?"
27430,"Heh, you and your jokes make me smile far too often, even when I do not want to. People will think I am getting soft."
27433,"Haha! Shush you! I'm supposed to be feeling bad about this whole thing. Oh, let's just get moving."
27434,*snicker*
27435,"I've sat through all of your little plots and plans. The least you can do is toss me a bone now and then. Yeesh, take <PRO_HISHER> thunder for one conversation and <PRO_HESHE> gets all touchy."
27436,Let's get out of here. We've still got things to do.
27437,"Yes, yes, you do what you can, not always what you want. The Big Little Book of Alaundo, right? Insightful."
27438,"I am sorry, <CHARNAME>, I shouldn't be taking my anger out on you. Let's just get moving. I'll be all right in a while."
27439,"Heh, a wise move. I will not have this situation made trite. I may be in a foul mood for a while, you understand? Yes, I think you do. Thank you."
27863,"Are you trying to tell me, bard, that you do not remember us? You were working for that evil sorceress, Silke, when we ran into you."
27865,"Well, you didn't have many thoughts in your head then, and it is obvious you do not have many now."
28450,"Perhaps you should go and soak your head within a bucket, guard, before you attempt to address me again."
29651,"Obviously, if I did have a problem, you would be the very last person I would be speaking to, you selfish and close-minded fool."
30033,You Amnian are too closed-minded about the demihuman kin that live amongst you in peace... they are not so different from you as you seem to think.
30059,"You certainly are not! And perhaps you should think, sir, before you speak such insults so candidly."
33335,"Too... weak... I feel the curse within... Damn you, Ployer! I'll be cured yet..."
33663,"Her cause seems just, and she is druid kin of a sort. Let us do our best to aid."
34526,"I will find my own way, and... *cough*... and damned if I won't live to see you die on this path you've chosen. Ah, I will waste no more breath on you!"
34528,You wish me gone! I— *cough* I shall seek help on my own. A word before I go: Beware your friends. No doubt they will eventually treat you as you treat them.
34529,"He was irredeemable when he was on trial. He lives because he ""donated"" to the state. I will make good use of our next meeting, but not just because of his attack."
38634,"No! You do not know. This is not the time for this conversation, child."
38636,"What are you babbling about, Imoen? I am not in the mood."
38638,You saw this? You watched as it was done?
38640,"Stop, I don't want to hear this."
38642,"Be quiet, child! No more!"
38644,"You've seen some horrible things best forgotten. We all have, in our day. This will pass when we... avenge the fallen and... bury this son of a bitch."
38646,Imoen! Enough! Let's go!
38675,"We have done nothing to you. I see that you are an elf... We are prisoners here, as are you. Perhaps if we could—"
38676,"Nonsense, he was secretive with everyone. We just had... mutual acquaintances."
38692,"So... I see we have a name for our captor at last. Irenicus, is it? Tell me, dryads, why this Irenicus would go to such lengths to keep you three here?"
38699,"Surely you won't refuse them the chance to return to their forest, <CHARNAME>? It takes no effort from us and would be a kindness to them. Think it over."
38720,"It is monstrous that one would do such a thing to a servant, to lock him away in an eternity of pain. It offends nature."
38726,"Nature does not intend her creations to live past their allotted time. Certainly not this forgotten servant, tormented and then left for dead, but not dead."
38729,"I wonder how this master came to live such a life that he abandons much of it? The fault of ill-considered magic, no doubt. We shall see when we find him."
38742,"<CHARNAME> will do as <PRO_HESHE> decides is best. While kind enough to give the beggar a coin, there is no need for <PRO_HIMHER> to give away everything <PRO_HESHE> owns."
38761,"For shame, <CHARNAME>, that you could speak to a child so. Have you no compassion for the helpless?"
38773,"Take care, <CHARNAME>. I have heard of these Cowled Wizards. Spellcasters of the highest order, the only magic-users allowed here in Amn, I believe."
38862,"Greetings to you, good sir. I trust all is well?"
38864,"I am not here in an official capacity, suspicious one. There is no need to worry."
38877,"The gnome is dead. How he was able to perform these great feats of illusion will have to remain a mystery, it seems."
38920,"That was unbecoming of you, <CHARNAME>, to be so forceful with one of such a lesser station. But I suppose you shall do as you wish regardless."
38941,"It sounds like there is a trade of flesh going on, <CHARNAME>, but questioning this man will get us nowhere. Perhaps a more thorough inquiry is called for."
38944,"I doubt this man is a prisoner, <CHARNAME>. More likely a slave, prohibitions notwithstanding. A revolting practice wherever it is carried out."
39178,"There is nothing wrong with a noble task duly undertaken. And perhaps it will be enjoyable to see you in a greener setting, dwarf."
39181,"I hope you intend to go to this village soon, <CHARNAME>. A visit to greener lands would be welcome after our trek through this crowded city."
39282,"You may wish to reconsider your refusal, <CHARNAME>. This may be a way to overcome the slavers here for good. It is the honorable path, if you are interested."
39362,"Do not overly concern yourself with the pursuit of precious metals alone, Korgan. There are other matters that we must consider here."
39364,"Ah, a chance to strike at the heart of slavery here in Athkatla. Think of it, <CHARNAME>; you could make a difference, if you wish. At least for a while."
39372,"A thoroughly despicable man... and an equally despicable place. This is the sort of thing that comes naturally with civilization, it seems."
39398,"No, he is not. He has no interest in anything you might have to sell, woman."
39402,"Druids would not attack a town without cause. It would be a very extreme reaction, <CHARNAME>, and is definitely something we should investigate."
39413,"You will not, Korgan. There is a disturbance in nature that we are to restore... I will not have you swinging about, heedless of the consequences."
39414,"You may wish to reconsider, Korgan. Doves can carry several diseases, and I wouldn't wish you vomiting and cramps simply for being an ignorant lout."
39415,"You're welcome to try, but you are not the only one trained in martial skill. Remember that in the forest, you are in my domain and at an extreme disadvantage."
39422,"I thought such childish antics to be above you, <CHARNAME>. But if it makes you feel better, I suppose I cannot stop you."
39424,"I cannot believe you would partake in such cruelty, <CHARNAME>. I refuse to watch this."
39590,"So... I see we have a name for our captor at last. Irenicus, is it? Tell me, dryads, why this Irenicus would go to such lengths to keep you three here?"
40725,"Get your hands off me! So help me, I'll..."
42212,"Where are the mirrors, the switches to pull to show where he is hidden...? *sob* Khalid...!"
42213,Damn... damn you...
42214,I... no.
42218,Damn you! I will have the heart of who has done this! I will tear their blackened heart from their... I will...
42219,Shut up! No more words! Words are nothing!
42221,Stranger! Nobody! I will not hear your words! Leave me!
42223,"No words! No more words! Save your speeches, save your proverbs! The only voice I wish to hear is... is dead! No more! No..."
42224,Imbecile! Affront to nature! What do you and your rodent know?! What can you know?!
42225,No...
42226,"Khalid of my heart, let my love... my love guide the way..."
42227,"Khalid? Silvanus, let him hear my vow... If I must, I shall empty this city of all within to find his killer... So do I swear."
42231,"It is my wont to do this, and I shall see that it is done properly. If you would assist, more the better. If not, be prepared to stand aside."
44178,"She seems distant. Those are not Imoen's eyes. Not the one we knew, anyway."
47077,"An excellent warning, if vague. I shall think on your words, though I doubt I shall alter my course. What will come will come."
48466,"Have you no sense of charity, dwarf? What is the sense of freeing such children only to subject them to starvation and destitution, then?"
48475,"Really, <CHARNAME>, couldn't you have spared a little gold for the child? You may have rescued them only to subject them to starvation and worse."
48480,"And one wonders how long you have been able to hide your arrogance and disregard behind a semblance of honor, Anomen. Helm would disapprove, I think."
48481,"I do not fear you, knight! Any moment you wish to meet on the field of battle, I will be there!"
48485,"It comes as no surprise to me that an immoral dwarf such as you has a heart of stone, Korgan. I simply expect better from <CHARNAME>."
48491,"That you did, <CHARNAME>, but there is a responsibility that comes with such actions as well. You might decide to ponder that at some point in the future."
48512,"How sad, to have been kept prisoner in such a state. And by what? The presence in the sword? It does not make sense."
48515,"A puzzle, obviously. We must find the four things spoken of to unlock whatever mystery is hidden here. Who would hide something in such a fashion, I wonder?"
48530,I think it would be an excellent idea to get outside of the city and administer justice on such evil creatures. Tyranny is best matched with equal force.
48534,"I've fought many an ogre in the past, dwarf, and many other powerful evil creatures aside from such. You should be wary that I do not add you to the list."
48551,"Ah, Gorion once said that he and some Harpers dealt a humiliating blow to a dragon in the Stormhorn Mountains. I was not aware this was the same one."
48573,"I am sure you have your reasons, <CHARNAME>, but be not quick to turn down an offer of sanctuary. I am not eager to battle paladins without need."
48592,"Indeed. They seek your agreement before telling you what they wish you to do. The Cowled Wizards are not to be trusted, <CHARNAME>, as you well know."
48599,"While surely all murderers must be brought to task, I wonder what manner of justice the Cowled Wizards would apply. It is something to consider."
48630,"We will have to be careful with the Cowled Wizards now at our heels. But it is a righteous cause, and another companion to stand at our side is always welcome."
48645,"And well you should be. This is coward's work, despicable to the core."
48668,"You are mistaken. I do not bear that name, and I will not. The greater balance bids me here."
48678,"You are lucky we did not allow the creatures to complete what they started. You are a fool, merchant, and should think with your head instead of your purse."
48693,I think I should like to walk through this place when we no longer need anything from the devil we know.
48762,"I... I am not always frowning, I... oh, go away, child. Why are the children of this city so annoying?"
48814,Hmm... wait one moment... do I know you?
48815,"I see. A Zhentish agent, if I recall, but one of no consequence. Pay him no heed, <CHARNAME>."
48889,"Ah, yes. The infamous capacity for drow compassion is revealed once again. Ignore her, <CHARNAME>, and let us get this task over with quickly."
48901,"Ah, Berinvar, <CHARNAME> is not a Harper, but I certainly am. Will you treat my guests as friends and answer? I assume the guardians are spectral harpists?"
48907,He and the others seem preoccupied with the trinkets around their necks. I find it odd I have not heard of this before now. Harpers do not often wear symbols to make themselves *more* noticeable.
48924,"This person makes me ill. <CHARNAME>, I suggest we move on before I ignore the greater balance and return him to the dust."
48926,No doubt you have plied your trade on good folk as well in the past. Your balance will come in the end. Nothing goes unpunished.
48951,"The confines of the city do much to chisel at the sanity of its inhabitants, but I wonder if there is some other force at work. We had best be wary."
48960,"I'm not sure the lieutenant should go alone. We have evidence of the culprit, but we know nothing of his ability. There may be danger we are not aware of."
48967,"His work?! What does he speak of? Quickly, <CHARNAME>, we must stop him before he escapes!"
48976,"This... this place smells heavily of death, <CHARNAME>, and the evidence of it is all around us. Step carefully, for I believe we enter the workshop sanctum of a madman."
48982,"I have little doubt, <CHARNAME>, that we will also find Lieutenant Aegisfield somewhere herein... Hopefully, the man is still alive."
49030,"You are mistaken, but I care not! Khalid will be avenged whether you stand aside willingly or not!"
49206,"I should think not! Child, surely you are better than this? Are you certain of this choice?"
49208,"That was unnecessarily harsh. I can see that we shall be at odds more often than not, drow."
49248,Such a lack of compassion is unseemly for a knight. Would you have others judge you as quickly?
49263,"One should not turn away an offered hand so quickly, <CHARNAME>, but I would be wary of its secretive origin. Perhaps we can find Imoen on our own."
49282,Shadow Thieves? Perhaps we shall finally get answers as to their interest in us.
49295,"My own Harpers have used us. I should have suspected... the gaudy necklaces, the invitation. Ah well. If Xzar was doing as she said, he deserved his fate."
49322,"I was wondering when you would turn up, Zhent. I had suspected our parting would not be permanent when last we met, and it appears my suspicions were correct."
49339,"Be wary, <CHARNAME>, the Harpers will not brook interference lightly, and this Zhent likely holds only the worst of intentions in his heart."
49347,"Well, if you wish to investigate what has happened to the spy, that is up to you, <CHARNAME>. I suggest caution and perhaps some common sense."
49348,"If the Harpers will even speak to us, which I doubt, they certainly will not reveal what they did with the halfling. Best not to ask about him directly."
49384,"It is good that this is the final of these tasks set for us. I've no taste for bounty hunting, but let us find this thief and have the deed done with quickly."
49404,"Yes, this is an odd structure for the Harpers to erect. I have never heard of an opulent base such as this. Secrecy has always been the watchword before."
49410,"I am a Harper, Meronia. May I be allowed to speak to these guardians? I assume they are spectral harpists. Perhaps they could satisfy my... curiosity."
49419,"Yes... I've noticed the amulets you wear. I've heard of the Harper pins, but nothing of these. Is this a local custom?"
49489,"Your memory is selective, Red Wizard. Why do you now work with Shadow Thieves, and what is your connection to our capture by Irenicus? Khalid is dead, and I will have an answer!"
49540,"How about conscience, dwarf? Or morality? Perhaps <CHARNAME> knows what is best."
49552,"Do not make us laugh, thief master. We have heard of your guild war. You would not approach outsiders if your own house were strong and solid, hm?"
49553,<CHARNAME>! You would abandon Imoen here? I would rather leave myself than have you cast her away in this place. It is not right.
49586,"You would leave a person in obvious distress to his own devices? I would have expected better of you, <CHARNAME>."
49599,"But it is the truth, is it not? I am a Harper myself, and we simply wish to be treated as guests. <CHARNAME> did bring you your poisoned friend, after all."
49606,"That was foolish, <CHARNAME>! The Harpers could have helped you. *sigh* But I suppose you will do as you always have, stubborn <PRO_MANWOMAN>."
49608,"I am a Harper, friend, and I think I see where this is heading... Is all this really necessary?"
49609,"*sigh* If the Harpers have asked this task to judge your worthiness, then there is no way around it. Let us proceed and be done with these ""creatures."""
49612,"Hmm, I am surprised they are letting us in, even after all this. I warn you, <CHARNAME>, be polite. Our reason for being here is questionable enough as it is."
49627,"Hmmm... it's nice to know there's a ""softer"" and ""sweeter"" side to you... ""Eddie."""
49631,"And all feared the Slayer, for it walked like a mortal, but in its wake there came murder, and in the future, there was death."
49778,"This is a dark place to meet this woman, <CHARNAME>, and I sense an unnaturalness about her that is disturbing to me. Step carefully."
49783,"How does she know of our link to the Shadow Thieves? And what would they think of this meeting? Be careful, <CHARNAME>, our lives may hang in the balance."
49812,"Boldly said, creature, yet you do not face us. <CHARNAME> has been underestimated by far better. You will rue the day of conflict when it comes, I think."
49886,"Step slowly, you do not look well at all. How do you feel?"
49913,"You have your money, <CHARNAME>, but you could have avoided the inevitable reputation of a kidnapper. Sometimes I think you act without due consideration."
49920,"Are you well? I am growing very worried about you, you know. I should not like to lose you in this evil place."
49924,"<CHARNAME>? Your lips move, but there is no sound. <CHARNAME>? <CHARNAME>!"
49953,"Nature is not so vindictive, fool. It cares not who prostrates before it, it cares only that the balance is maintained."
49963,"This is the hilt of a long sword. It appears to have been forged by a fine craftsman, even though the blade was broken off long ago and the pommel is obviously missing a large gem.

STATISTICS:

Weight: 2"
49969,You would have killed me if I had let you. You would have left me to rot in this place.
49974,"I'm not sure you should try to control it. We must distance you from it, not embrace it. We will make do despite the danger."
49975,"No, you should not be alone during this. We will get through, I am sure. We just have to keep going, no matter what comes."
49976,You are not the only one affected by this! It is so hard to see you...
49977,"<CHARNAME>, please, let's just keep moving. We'll get through, I'm sure of it. Really."
50006,Are you well? It would only be fitting to take some time to rest. You have been through quite an ordeal.
50011,"Very well, but keep me apprised of your condition. Imoen supposedly went through the same ritual, but she did not seem to suffer from sudden attacks like that."
50013,"That is troubling. I do not know what effect having the ritual had on you, but it does appear to be different from what Imoen suffered. Odd."
50037,"I am glad that you have chosen this course, <CHARNAME>. This cult stinks of wrongness, an affront against nature that must be stopped!"
50053,"You align yourself with a temple that threatens its followers? You would bow down before a vindictive god, <CHARNAME>? You are strange indeed."
50100,"Hold, <CHARNAME>, do not be foolish! You there... how can we be certain of your innocence? Why are you here if you are no longer members of the cult?"
50121,"<CHARNAME>! This... this is the same child-killing gnome from Baldur's Gate! I remember! For the greater balance, his head must be brought to the authorities!"
50124,"I... I understand. It is an avatar of a faded god, left guarding an item that has waned in power. Loathing has replaced the worship of his followers. A lingering fate."
50534,"I have no love for drow, or for this drow in particular... but it seems that she has done nothing to deserve this fate other than simply be a drow. This is not justice."
50555,"Is that what you see as justice, <CHARNAME>? I sensed great sadness behind her darkness. With balance, she might have been... well, who knows?"
50566,"Truth be known, I am not opposed to having Viconia travel with us. Remember, though, that many will think less of us simply because she is here."
50639,<CHARNAME>? Are you... yourself? That was... the Slayer! You became a form of the avatar of Bhaal... but the god is dead...
50640,"<CHARNAME>, this is not right at all."
50660,"<CHARNAME>, we had best move quickly! The mages you have let loose will need direction, or they will be impossible to control."
50957,"We must be subservient, <CHARNAME>. To them, we are lesser drow and no doubt under suspicion. Any sign of disobedience would bring scrutiny upon us."
50958,"The drow have a harsh culture, one I am not overly familiar with. We must harden our hearts if we are to blend in. The alternative is discovery and death."
51254,"Just what are you on to, <CHARNAME>? You think I am blind, not to see your foolish behavior with the drow woman? Why would you play such an idiotic game...? Do you not remember our situation?"
51261,Jealous of a simple drow that turns her eyes up at you? Is your opinion of me so low? I merely think that flirtations will gain nothing and endanger us all.
51264,It is a foolish one. Drow enjoy neither affection nor intense attraction. Sex is nothing but a game to them. To indulge would be... disappointing.
51265,"Oh? I am disappointed. Indulge your carnality, by all means, if it means so much to you. I shall say no more on that subject or any other."
52240,"You spent quite some time in the drow woman's chambers, <CHARNAME>. Care to elaborate what you were about, as if I did not know?"
52246,"I suppose that is true enough, although I can think of several lies you might have tried for our sake. But I trust you enough. Let us just... move on."
52247,Hmph. You are just the sort to lie to me about this. And that this makes me uncomfortable is even worse. I think I prefer to be on my own for a time.
52248,"I know the purpose. Simple self-gratification, or do you maintain there was no way to avoid the situation? Ahhh, enough... I do not want to hear any more."
52249,"I am sorry too, and disappointed, but I suppose it could not be avoided... with you being male and in this guise. I shall... attempt to forget about it."
52250,"No? Very well. I shall endeavor to keep my shrewish opinions to myself, on this and all other matters regarding us."
52251,Hmmm... out so soon? Did the drow woman not dig her claws into you successfully? That is good. I shudder to think what might have happened otherwise.
52293,"How can you refuse so coldly? I will not stand idly by. Nalia... we will aid you, as will <CHARNAME>, I am sure. What is the problem, precisely?"
55188,"A bitter end to a terrible man. We did well, I think, but I am not certain that all has been restored to as it was. <CHARNAME>? Do you feel any different?"
55210,"It... it is not finished, is it? This is death... and your strange power has dragged me here with you. ...So be it then. We stand together until the end."
55650,I understand plenty already! This place reeks of corruption and deceit!
55671,"Rest, child. None of this group shall harm you."
55672,Oh? Is that what those retching noises were? I thought that perhaps there was a wounded seal somewhere onboard giving birth.
55677,"Okay, I'm not quite so concerned about this little freak. Rule as you will, little tyrant, just as long as it is from a cell."
55686,"I suppose we could expect no less from a simple pirate. Begone with you then, scoundrel. No doubt you would only bring us more trouble here than we need."
55693,These are the same creatures we fought when we entered the lair of the vampire that was aligned against your own guild. Bodhi must be nearby indeed.
