StrRef,Text
55698,"Do you spend all your time in the guise of others, child? Do you not take solace in the balance of your true self?"
55726,War? War amongst the elves? What could that mean? How could even Irenicus start such a thing? That would bring nothing but ruin!
55740,"As much as I should not trust his advice, he may have a point, <CHARNAME>. There are powerful mages above who may be the difference between life and death."
55779,"What revenge do *you* have, wizard? You killed my Khalid with no more thought than one would give to a fly! I shall have *my* revenge! Nature's fury shall strike you down!"
55788,"You think us fools?! You knew your ship was scuttled when you first spoke to us, didn't you?! You seek to use us somehow!"
55809,She sees the universe unrestricted. It is amazing that she manages to be as lucid as she is.
55813,"And what would you have to do with that, Edwin? Perhaps if ego were all that was required."
55821,"I should have known. Once again your peculiar destiny has drawn us into something, <CHARNAME>. Even the shark gods flounder in anticipation of your arrival."
55840,"I have never known you to be so judgmental, paladin. Surely you do not label all sahuagin so? Condemn them all to death and you are no better than they."
55859,"Must it come to slaughter, sahuagin? Your priestesses speak of your entire people needing your blood... Have you attempted to resolve this with the king peacefully?"
55876,"Well, Viconia. It would seem you carry less weight than you thought. He questions your worth, rightfully so."
55889,"A most underhanded maneuver, <CHARNAME>. Although I am sure it is no less than Phaere might have planned for us. There is an ironic justice in this, no?"
55895,So... a war? Open battle between the drow and the surface has not occurred in... eons. With a greater demon to back them... I truly wonder why Irenicus would do this.
55913,"You would commit such a sacrilege against nature?! Had I known, I would never have accompanied you! No, I will not let this be!"
55921,"As much as I despise this form, it does seem to have captivated our friend here. He seems fearful."
55934,"Despite what she says, <CHARNAME>, we may be able to use this situation to our advantage. Perhaps there is no need to kill Solaufein. Consider this, at least."
55948,"Drow roaming the surface, even the most noble, should expect an occasional misunderstanding. I am sure this can be worked out, <CHARNAME>... I suggest you try."
55966,"This drow is well respected by the Harpers, <CHARNAME>. I will not assist you fighting him. I will return to Athkatla; consider your idiocy before we speak again."
55997,"An excellent idea, <CHARNAME>. Adding Drizzt and his companions to our battle against Bodhi will certainly tip the scales. You show great wisdom."
56009,"I know of this one, <CHARNAME>, from the Harpers. A drow of good alignment and heroic reputation. He is deserving of respect."
56041,"A fine sentiment, Cernd, though we may be forced into more trouble than we wish."
56080,That was close. We must make an effort to act as we appear.
56083,The Seldarine? The collection of elven gods led by Corellon Larethian? How would he ever propose to join such ranks? Mad! Mad!
56085,"Your soul is borrowed, and it shall be returned. You are a blight upon nature, and you shall be destroyed!"
56087,"Edwin, in some another time... some other place, such a comment would get you a beating of mythic proportions. It may yet."
56111,"No more platitudes, Irenicus. You have taken much from all of us. Now you die your final death!"
56130,<CHARNAME>! I will not let you do this! You will not murder those that beg for aid! Who will follow me?!
56154,It would appear that neither of us have much of a choice in the matter. We must trust one another.
56162,"Of course, my Lady Adalon. <CHARNAME>, do keep quiet."
56165,It is unfortunate that they did not offend you in some way. We might have been spared the headache of this journey if they had to face an angry silver.
56174,To become such a hated thing... I do not look forward to that.
56176,"You should have made more of an effort. We have an obligation to destroy you, as if we needed more reasons."
56413,"Knock him on the head? It is obvious this lout has no compassion for others and no inclination of how nature must be protected. Ignore him, <CHARNAME>."
56417,"<CHARNAME>, you can't seriously consider poisoning this font. If there is evil there, we must cleanse it. To destroy it is sacrilege! I will not allow it!"
56425,"No, <CHARNAME>, no! This is evil! You poison nature itself! I shall not partake in this... who stands with me?!"
56453,"These people are slaves, mentally as well as physically, controlled despite themselves. All we can offer them, unfortunately, is a quick death."
56457,"There are many who easily sidestep laws through wealth. Perhaps, in this case, it would be best to see why the law has failed so."
56461,"The law may not be able to do anything, Anomen, but such men as this Saerk always trip over their own schemes. If he is responsible, he will pay, as you say."
56465,"Too many of the wealthy escape justice, yes. If you are sure that Saerk is responsible for the death of your sister, then we must ensure he pays dearly!"
56470,By... by the gods! You foolish man! Can you say that this young woman was a murderer as well?! You have murdered an innocent!
56474,"I have the feeling we are intruding on a very private matter, <CHARNAME>. I feel uncomfortable with our intrusion; perhaps we should leave..."
56481,"A fair line easily used by servants of the wizard themselves. We have been imprisoned and worse, and given many reasons to distrust strangers we encounter."
56487,"You have extorted a payment from Raelis in return for our help, <CHARNAME>. I do not agree with this decision... it smacks of selfish greed."
56498,"We must be calm, <CHARNAME>. Vengeance will only bring conflict with the guard. To help Nalia, we must prove that our cause is just... there is no other way."
56508,"A mind flayer? Here? A spy perhaps, using its psionic powers to keep its secret. Strange that Jan's mad uncle should be aware of its presence."
56516,"You speak as if unaware of class distinction, and yet your manner exudes it. A sign of immaturity... perhaps adventuring is not the place for you."
56517,"You speak as if unaware of class distinction, and yet your manner exudes it. A sign of immaturity... good, then, that <CHARNAME> is sending you ahead."
56528,You dare reprimand those who have died defending you? Even now they strive to protect you from evil you don't even understand! You could have been dead!
56551,"I have no fear for his well-being, monster."
56877,"Where? Where exactly is it being put to good use? We are not to be played with, Linvail. I should like to see results, and I should like to see them soon."
56899,"Oh, how generous. Do you expect that to compensate while you delay our more important concerns? We have friends in need of rescue and vengeance both!"
56906,And vengeance!
57066,"I see. You must be the rogue, Jarlaxle, that was mentioned to us, yes?"
57396,"A poor thing, <CHARNAME>. We could have done better by these people with minimal effort. It is a better fate than what the drow had in store, however."
57455,"No. ""Veldrin"" would not be interested in such diversions, male. I... as a female, I command you to stand away from him. Slug."
57903,"Yes, declare your loyalty, Viconia. When you eventually betray us, I will hold your statement up as proof of the untrustworthy nature of your kind."
57911,"Cernd, I would normally bow to your wisdom, but in this matter, I think you are... mistaken. I make no protest; I merely wish to state my opinion."
58132,"We are bought off yet again. I do not deny that they are the best chance we have to find our quarry, but we had best do their little chores quickly."
58133,"Thank you for your opinion, Korgan. I'll just place it over here where it can collect flies all on its own."
58164,"You baffle me sometimes, Cernd, but I bow to your wisdom on this matter."
58186,"Not just thieves, but traitorous thieves. Our associations sink ever lower in Aran's service. Let's get this over with."
58187,"I have heard some in the Harpers speak of it. It is more than a prison or supposed asylum; it is a place to forget people that are ""troublesome."""
58198,"Long ago, I promised to assist you if your adopted father fell. That promise has not expired, nor has your worthiness. I stand with you if you will have me."
58247,"It is not necessary to say anything, <CHARNAME>. I know what comes next... I know what may happen. To either of us."
58248,We have been through too much to let that stop what you must do. For all the pain that losing Khalid brought... I would not give up our years of good works.
58249,Let us regain your soul and make you whole again. And what comes after... comes after. I look forward to it... should the gods prove willing.
58518,"No, Valygar, we shall not give up on you. The Cowled Wizards believe much if they think to use everyone as they wish. You will receive nothing this day, mage!"
58719,"You will hear the name ""traitor"" many more times today, Yoshimo, but let me be the first among the group to spit it at you!"
60891,"I no more want the trip than you do, so I will not force and I will not leave, but I cannot rest easy until we go."
60892,"If you wish, Dermin, you may return whence you came with the message that ""Jaheira the Harper"" is dead."
60893,"Perhaps we will meet again, but I shall not look forward to it!"
61015,I find it odd that this Irenicus would leave of his own volition. And why take Imoen when it is <CHARNAME> he is so obviously interested in? Perhaps he expects us to give chase?
61016,"We must step carefully then. We know little about him... whom he was fighting, who took him, or even where we are. We seem to be drawn into machinations not of our own making."
61018,"Do not be foolish, Minsc. We must know our enemies... and the extent of our danger here... before we rush into anything."
74583,"You can't work with such as this, <CHARNAME>. Have you forgotten all that Gorion taught you?"
74809,"Take a moment and think, <CHARNAME>. What would Gorion say about this pointless bloodshed?"
75712,"Careful, <CHARNAME>. We want to walk into the gorge, not fall into it."
77110,"Beware, <CHARNAME>. You cannot trust a tanar'ri."
81447,An evil one.
87844,We must proceed with caution. The Red Wizards are devious. They will expect retaliation.
88081,"Animals should be wild, not kept as pets by wandering heroes. Tell Barad the gift is appreciated but inappropriate."
88457,"The half-elf's magic may represent a threat to the balance, but I think she would do less harm with us than without us."
89488,"Ha. My advice has the virtue of being in the common tongue, at least. And I can take the shape of a bear when I please."
89527,Refusing to engage with him further was wise. I sense that he is a part of the magic that infects this forest.
96641,You disappoint me more than I could ever say. I am glad Gorion is not around to see this.
100114,"<CHARNAME>, do you think it wise to spend so much time with Dorn? He seems to have taken an unhealthy interest in you."
100115,He is not to be trusted.
100116,He is a murderous half-orc with an unquenchable bloodlust. He is incapable of the feelings you and I possess.
100117,"If you intend to take up with a barbaric half-orc, I must end this."
100118,"I am relieved to hear that, <CHARNAME>."
100119,I am glad Gorion did not live to see this.
