StrRef,Speaker,Text,WAV_Reference,Chapter,Source_File
50013,Jaheira,"That is troubling. I do not know what effect having the ritual had on you, but it does appear to be different from what Imoen suffered. Odd.",,1,JAHEIRAJ
50037,Jaheira,"I am glad that you have chosen this course. This cult stinks of wrongness, an affront against nature that must be stopped!",,1,JAHEIRAJ
50041,Minsc,"An assault on the most foul and evil of creatures! Such a victory shall make us heroes to be sung of throughout the land! Glory will be ours, oh yes!",,1,MINSCJ
50053,Jaheira,You align yourself with a temple that threatens its followers? You would bow down before a vindictive god? You are strange indeed.,,1,JAHEIRAJ
50093,Minsc,The priest turns on us! For shame! Boo will gnaw on his eye sockets for this travesty!,,1,MINSCJ
50100,Jaheira,"Hold, do not be foolish! You there... how can we be certain of your innocence? Why are you here if you are no longer members of the cult?",,1,JAHEIRAJ
50106,Minsc,"We are stopping now? Why are we stopping? We are heroes, and heroes must face the final enemy and win over all!",,1,MINSCJ
50121,Jaheira,"This... this is the same child-killing gnome from Baldur's Gate! I remember! For the greater balance, his head must be brought to the authorities!",,1,JAHEIRAJ
50122,Minsc,"Boo remembers! Baldur's Gate! Neb the child murderer! You die, gnome, you die! RAAAAAGGGGGHHHH!",,1,MINSCJ
50124,Jaheira,"I... I understand. It is an avatar of a faded god, left guarding an item that has waned in power. Loathing has replaced the worship of his followers. A lingering fate.",,1,JAHEIRAJ
50130,Minsc,Tiny has met a god before this?,,1,MINSCJ
50301,Minsc,"Boo is my stalwart companion, and he says that if you must wear the skins of a dead animal around your neck, the evil sharp-toothed weasel is a good choice.",,1,MINSCJ
50343,Minsc,"Minsc and Boo fight with swords and teeth for goodness, not for countries. We are heroes, not soldiers, funny man.",,1,MINSCJ
50416,Minsc,"He attacks? Such a display of wrongness fills even Boo with disgust! For my hamster, I must land a blow for goodness!",,1,MINSCJ
50534,Jaheira,"I have no love for drow, or for this drow in particular... but it seems that she has done nothing to deserve this fate other than simply be a drow. This is not justice.",,1,JAHEIRAJ
50537,Minsc,They... they will not burn the pretty elf? There must be no burning if she has committed no crime! This is not justice! we stop this travesty!,,1,MINSCJ
50555,Jaheira,"Is that what you see as justice? I sensed great sadness behind her darkness. With balance, she might have been... well, who knows?",,1,JAHEIRAJ
50557,Minsc,"We do not rescue her? What was her crime? Maybe darker elves are not all good, but surely not all are totally evil? I am... confused. What does Boo think?",,1,MINSCJ
50566,Jaheira,"Truth be known, I am not opposed to having Viconia travel with us. Remember, though, that many will think less of us simply because she is here.",,1,JAHEIRAJ
50578,Minsc,"We have saved her, and she is our responsibility. What if she was captured again? Neither Boo nor I could live with ourselves. No, she must come.",,1,MINSCJ
50639,Jaheira,Are you... yourself? That was... the Slayer! You became a form of the avatar of Bhaal... but the god is dead...,,1,JAHEIRAJ
50640,Jaheira,this is not right at all.,,1,JAHEIRAJ
50660,Jaheira,"we had best move quickly! The mages you have let loose will need direction, or they will be impossible to control.",,1,JAHEIRAJ
50670,Minsc,Boo is worried that these inmates will harm themselves. We should see that they are safe and make sure they each have a hamster of their own.,,1,MINSCJ
50671,Minsc,That last part was my idea.,,1,MINSCJ
50957,Jaheira,"We must be subservient. To them, we are lesser drow and no doubt under suspicion. Any sign of disobedience would bring scrutiny upon us.",,1,JAHEIRAJ
50958,Jaheira,"The drow have a harsh culture, one I am not overly familiar with. We must harden our hearts if we are to blend in. The alternative is discovery and death.",,1,JAHEIRAJ
51254,Jaheira,"Just what are you on to? You think I am blind, not to see your foolish behavior with the drow woman? Why would you play such an idiotic game...? Do you not remember our situation?",,1,JAHEIRAJ
51261,Jaheira,Jealous of a simple drow that turns her eyes up at you? Is your opinion of me so low? I merely think that flirtations will gain nothing and endanger us all.,,1,JAHEIRAJ
51264,Jaheira,It is a foolish one. Drow enjoy neither affection nor intense attraction. Sex is nothing but a game to them. To indulge would be... disappointing.,,1,JAHEIRAJ
51265,Jaheira,"Oh? I am disappointed. Indulge your carnality, by all means, if it means so much to you. I shall say no more on that subject or any other.",,1,JAHEIRAJ
52240,Jaheira,"You spent quite some time in the drow woman's chambers. Care to elaborate what you were about, as if I did not know?",,1,JAHEIRAJ
52246,Jaheira,"I suppose that is true enough, although I can think of several lies you might have tried for our sake. But I trust you enough. Let us just... move on.",,1,JAHEIRAJ
52247,Jaheira,Hmph. You are just the sort to lie to me about this. And that this makes me uncomfortable is even worse. I think I prefer to be on my own for a time.,,1,JAHEIRAJ
52248,Jaheira,"I know the purpose. Simple self-gratification, or do you maintain there was no way to avoid the situation? Ahhh, enough... I do not want to hear any more.",,1,JAHEIRAJ
52249,Jaheira,"I am sorry too, and disappointed, but I suppose it could not be avoided... with you being male and in this guise. I shall... attempt to forget about it.",,1,JAHEIRAJ
52250,Jaheira,"No? Very well. I shall endeavor to keep my shrewish opinions to myself, on this and all other matters regarding us.",,1,JAHEIRAJ
52251,Jaheira,Hmmm... out so soon? Did the drow woman not dig her claws into you successfully? That is good. I shudder to think what might have happened otherwise.,,1,JAHEIRAJ
52288,Minsc,"True heroes demand no reward, and Boo knows you to be a true hero! We need only know what foes we are to face before the boot-stomping can begin!",,1,MINSCJ
52293,Jaheira,"How can you refuse so coldly? I will not stand idly by. Nalia... we will aid you, as will you, I am sure. What is the problem, precisely?",,1,JAHEIRAJ
52295,Minsc,No! Say it cannot be so! we must rescue the nice man's child and be off! Unless... unless you have some plan? Minsc is confused.,,1,MINSCJ
52306,Minsc,No! Has you truly fallen so far? A glorious rescue has turned into a nightmare of epic proportion! Minsc and Boo will stop you!,,1,MINSCJ
52607,Minsc,Boo knows! Do not stow thrones in grass houses!,,1,MINSCJ
55186,Minsc,"The evil wizard is dead! Once again, Boo and Minsc and you emerge as victorious heroes! Much rejoicing and celebrating must be commencing soon!",,1,MINSCJ
55188,Jaheira,"A bitter end to a terrible man. We did well, I think, but I am not certain that all has been restored to as it was. Do you feel any different?",,1,JAHEIRAJ
55208,Minsc,"Oh, such a glorious death in battle for Minsc and Boo! We were well on our way to the great fields and halls of Rashemen, but we felt you needing us, so we came!",MINSC87,1,MINSCJ
55210,Jaheira,"It... it is not finished, is it? This is death... and your strange power has dragged me here with you....So be it then. We stand together until the end.",JAHEIRD3,1,JAHEIRAJ
55650,Jaheira,I understand plenty already! This place reeks of corruption and deceit!,,1,JAHEIRAJ
55668,Minsc,"This young minstrel has lost his wits and his songs? Minds are common enough, but tunes of merit are few and far between.",,1,MINSCJ
55671,Jaheira,"Rest, child. None of this group shall harm you.",,1,JAHEIRAJ
55672,Jaheira,Oh? Is that what those retching noises were? I thought that perhaps there was a wounded seal somewhere onboard giving birth.,,1,JAHEIRAJ
55677,Jaheira,"Okay, I'm not quite so concerned about this little freak. Rule as you will, little tyrant, just as long as it is from a cell.",,1,JAHEIRAJ
55680,Minsc,"Yes! Such fire and conviction! A pity there are no actual enemies to warrant the screaming, but good show anyway. Boo applauds!",,1,MINSCJ
55684,Minsc,"It is okay to come out now, Boo. The pale woman is gone. You can stop shivering too. You are a warrior hamster, so be brave! Brave!",,1,MINSCJ
55686,Jaheira,"I suppose we could expect no less from a simple pirate. Begone with you then, scoundrel. No doubt you would only bring us more trouble here than we need.",,1,JAHEIRAJ
55689,Minsc,All good peoples hang their head in shame! We are betrayed! The sailor man brings the vampires back amongst us... there shall be a mighty reckoning for this!,,1,MINSCJ
55693,Jaheira,These are the same creatures we fought when we entered the lair of the vampire that was aligned against your own guild. Bodhi must be nearby indeed.,,1,JAHEIRAJ
55694,Minsc,"I do not think Boo is too thrilled about you borrowing his face. He only has the one. You don't hurt those you mirror, do you?",,1,MINSCJ
55698,Jaheira,"Do you spend all your time in the guise of others, child? Do you not take solace in the balance of your true self?",,1,JAHEIRAJ
55726,Jaheira,War? War amongst the elves? What could that mean? How could even Irenicus start such a thing? That would bring nothing but ruin!,,1,JAHEIRAJ
55740,Jaheira,"As much as I should not trust his advice, he may have a point. There are powerful mages above who may be the difference between life and death.",,1,JAHEIRAJ
55763,Minsc,"Ughh, my head spins. So many quick words from so many small sources. Countersong, Boo. Relax my frazzled nerves.",,1,MINSCJ
55767,Minsc,What does everyone stare at? Boo's churring calms me down. See?,,1,MINSCJ
55776,Minsc,"Yes! Revenge! Revenge for precious Dynaheir! Tremble, wizard, for the mighty Boo will have your eyes! RAAAARRRRGHH!",,1,MINSCJ
55779,Jaheira,"What revenge do *you* have, wizard? You killed my Khalid with no more thought than one would give to a fly! I shall have *my* revenge! Nature's fury shall strike you down!",,1,JAHEIRAJ
55784,Minsc,"That's a much shorter interjection than Boo has become used to, Jan. Are you ill?",,1,MINSCJ
55788,Jaheira,"You think us fools? You knew your ship was scuttled when you first spoke to us, didn't you? You seek to use us somehow!",,1,JAHEIRAJ
55809,Jaheira,She sees the universe unrestricted. It is amazing that she manages to be as lucid as she is.,,1,JAHEIRAJ
55813,Jaheira,"And what would you have to do with that, Edwin? Perhaps if ego were all that was required.",,1,JAHEIRAJ
55819,Minsc,No! No collar! I will not be collared by the smelly fishmen! My warrior spirit will not bear such a thing!,,1,MINSCJ
55821,Jaheira,I should have known. Once again your peculiar destiny has drawn us into something. Even the shark gods flounder in anticipation of your arrival.,,1,JAHEIRAJ
55825,Minsc,"Boo too has small teeth compared to fish-men. But they hurt just the same when they latch onto the eyes, yes sir!",,1,MINSCJ
55840,Jaheira,"I have never known you to be so judgmental, paladin. Surely you do not label all sahuagin so? Condemn them all to death and you are no better than they.",,1,JAHEIRAJ
55859,Jaheira,"Must it come to slaughter, sahuagin? Your priestesses speak of your entire people needing your blood... Have you attempted to resolve this with the king peacefully?",,1,JAHEIRAJ
55861,Minsc,"My skin may not have scales, but it has seen many suns come and go. Boo thinks you could use some sun too. Then you might not smell so much like wet laundry.",,1,MINSCJ
55876,Jaheira,"Well, Viconia. It would seem you carry less weight than you thought. He questions your worth, rightfully so.",,1,JAHEIRAJ
55882,Minsc,"Don't worry, Aerie. I'm here to protect my witch. Boo too, though I think he would leap to protect anyone in distress. It's his heroic nature, you know.",,1,MINSCJ
55889,Jaheira,"A most underhanded maneuver. Although I am sure it is no less than Phaere might have planned for us. There is an ironic justice in this, no?",,1,JAHEIRAJ
55892,Minsc,"Boo bristles at his words. I don't know the language, but he is insulting us for certain!",,1,MINSCJ
55895,Jaheira,So... a war? Open battle between the drow and the surface has not occurred in... eons. With a greater demon to back them... I truly wonder why Irenicus would do this.,,1,JAHEIRAJ
55913,Jaheira,"You would commit such a sacrilege against nature? Had I known, I would never have accompanied you! No, I will not let this be!",,1,JAHEIRAJ
55915,Minsc,I cannot believe my ears! You would stand against all that is good and right? You shall suffer a terrible vengeance for this!,,1,MINSCJ
55921,Jaheira,"As much as I despise this form, it does seem to have captivated our friend here. He seems fearful.",,1,JAHEIRAJ
55922,Minsc,Yes! Hello! Minsc is a drow! And Boo is a shadow hamster!,,1,MINSCJ
55934,Jaheira,"Despite what she says, we may be able to use this situation to our advantage. Perhaps there is no need to kill Solaufein. Consider this, at least.",,1,JAHEIRAJ
55948,Jaheira,"Drow roaming the surface, even the most noble, should expect an occasional misunderstanding. I am sure this can be worked out... I suggest you try.",,1,JAHEIRAJ
55966,Jaheira,This drow is well respected by the Harpers. I will not assist you fighting him. I will return to Athkatla; consider your idiocy before we speak again.,,1,JAHEIRAJ
55968,Minsc,"Another drow who speaks strange words! Even Boo bristles at his obvious lies! If you fights, then so does Minsc! Prepare for liberal butt-kickings!",,1,MINSCJ
55997,Jaheira,An excellent idea. Adding Drizzt and his companions to our battle against Bodhi will certainly tip the scales. You show great wisdom.,,1,JAHEIRAJ
56009,Jaheira,"I know of this one, from the Harpers. A drow of good alignment and heroic reputation. He is deserving of respect.",,1,JAHEIRAJ
56017,Minsc,"Ooh, another drow! I begin to see them everywhere, ever since the Underdark! They are so vicious even Boo cowers. What will we do?",,1,MINSCJ
56018,Minsc,I do not cause trouble! I merely seek it out and put the bootheels of justice to it! Ask Boo!,,1,MINSCJ
56041,Jaheira,"A fine sentiment, Cernd, though we may be forced into more trouble than we wish.",,1,JAHEIRAJ
56067,Minsc,"Boo is impressed, Korgan. You remember well to act like drow.",,1,MINSCJ
56080,Jaheira,That was close. We must make an effort to act as we appear.,,1,JAHEIRAJ
56083,Jaheira,The Seldarine? The collection of elven gods led by Corellon Larethian? How would he ever propose to join such ranks? Mad! Mad!,,1,JAHEIRAJ
56085,Jaheira,"Your soul is borrowed, and it shall be returned. You are a blight upon nature, and you shall be destroyed!",,1,JAHEIRAJ
56086,Minsc,"For Dynaheir and all fallen comrades, for what is good and right, for all these things shall Minsc and Boo fall upon you today! And we shall taste victory, evil man!",,1,MINSCJ
56087,Jaheira,"Edwin, in some another time... some other place, such a comment would get you a beating of mythic proportions. It may yet.",,1,JAHEIRAJ
56092,Minsc,"Neither do we, right, Boo?",,1,MINSCJ
56093,Minsc,What's so funny?,,1,MINSCJ
56111,Jaheira,"No more platitudes, Irenicus. You have taken much from all of us. Now you die your final death!",JAHEIRD2,1,JAHEIRAJ
56112,Minsc,"I grow tired of shouting battle cries when fighting this mage. Boo will finish his eyeballs once and for all so he does not rise again! Evil, meet my sword! SWORD, MEET EVIL!",MINSC86,1,MINSCJ
56124,Minsc,"Worry not, Viconia! Minsc and Boo stand at the ready to protect! Right, Boo?",,1,MINSCJ
56127,Minsc,No! You will not attack the small dark ones! Minsc and Boo will not allow it! And I hope no other will either!,,1,MINSCJ
56130,Jaheira,I will not let you do this! You will not murder those that beg for aid! Who will follow me?,,1,JAHEIRAJ
56152,Minsc,"And then Minsc will disrupt them with his bootheel! Yes, speak more of this evil-smashing partnership!",,1,MINSCJ
56154,Jaheira,It would appear that neither of us have much of a choice in the matter. We must trust one another.,,1,JAHEIRAJ
56162,Jaheira,"Of course, my Lady Adalon. do keep quiet.",,1,JAHEIRAJ
56165,Jaheira,It is unfortunate that they did not offend you in some way. We might have been spared the headache of this journey if they had to face an angry silver.,,1,JAHEIRAJ
56170,Minsc,Boo shakes with disbelief! Such a crime will not go unanswered!,,1,MINSCJ
56174,Jaheira,To become such a hated thing... I do not look forward to that.,,1,JAHEIRAJ
56176,Jaheira,"You should have made more of an effort. We have an obligation to destroy you, as if we needed more reasons.",,1,JAHEIRAJ
56198,Minsc,Boo would have found her wherever she tried to put her evil foot! That's what we do!,,1,MINSCJ
56409,Minsc,"Irenicus is the most vile of villains if he dared destroy a whole city! I can't believe that, and I have believed some amazing things, let me tell you!",,1,MINSCJ
56413,Jaheira,Knock him on the head? It is obvious this lout has no compassion for others and no inclination of how nature must be protected. Ignore him.,,1,JAHEIRAJ
56417,Jaheira,"you can't seriously consider poisoning this font. If there is evil there, we must cleanse it. To destroy it is sacrilege! I will not allow it!",,1,JAHEIRAJ
56420,Minsc,"Groves are wonderful... you wouldn't really poison one, would you? Boo suggests that perhaps you are tricking this evil little man. Smart thinking, I agree.",,1,MINSCJ
56425,Jaheira,"No, no! This is evil! You poison nature itself! I shall not partake in this... who stands with me?",,1,JAHEIRAJ
56429,Minsc,This is the evil killer who takes skins that do not belong to him! We have discovered him! We must take the bootheel to his ways!,,1,MINSCJ
56453,Jaheira,"These people are slaves, mentally as well as physically, controlled despite themselves. All we can offer them, unfortunately, is a quick death.",,1,JAHEIRAJ
56457,Jaheira,"There are many who easily sidestep laws through wealth. Perhaps, in this case, it would be best to see why the law has failed so.",,1,JAHEIRAJ
56458,Minsc,"To decide between justice and honor! Oh, it is a conundrum that would tie even Boo up in knots. I do not envy you. My decisions are usually easier than this.",,1,MINSCJ
56461,Jaheira,"The law may not be able to do anything, Anomen, but such men as this Saerk always trip over their own schemes. If he is responsible, he will pay, as you say.",,1,JAHEIRAJ
56465,Jaheira,"Too many of the wealthy escape justice, yes. If you are sure that Saerk is responsible for the death of your sister, then we must ensure he pays dearly!",,1,JAHEIRAJ
56470,Jaheira,By... by the gods! You foolish man! Can you say that this young woman was a murderer as well? You have murdered an innocent!,,1,JAHEIRAJ
56471,Minsc,No! Minsc did not come here to kill young girls! You cannot tell us that the young girl was anything but innocent! This is not right!,,1,MINSCJ
56474,Jaheira,I have the feeling we are intruding on a very private matter. I feel uncomfortable with our intrusion; perhaps we should leave...,,1,JAHEIRAJ
56481,Jaheira,"A fair line easily used by servants of the wizard themselves. We have been imprisoned and worse, and given many reasons to distrust strangers we encounter.",,1,JAHEIRAJ
56482,Minsc,"We serve no evil mages, no sir! But Boo looks upon you with suspicion, little man. How is it you come to be here? Never have I seen Boo's whiskers quiver so!",,1,MINSCJ
56483,Imoen,"Athkatla? That's... the City of Coin, right? A merchant city in Amn. We come from the Sword Coast, a ways to the north. Why do you think we're in Athkatla?",,1,IMOENJ
56484,Minsc,"Then you too know the hardship of being set into a maze like a helpless hamster! We are comrades in peril! Boo asks what you propose we do next, little man.",,1,MINSCJ
56487,Jaheira,You have extorted a payment from Raelis in return for our help. I do not agree with this decision... it smacks of selfish greed.,,1,JAHEIRAJ
56492,Minsc,"What is this? Minsc and Boo were just getting into this wonderful story when it was sadly interrupted. A work of mastery, this is!",,1,MINSCJ
56498,Jaheira,"We must be calm. Vengeance will only bring conflict with the guard. To help Nalia, we must prove that our cause is just... there is no other way.",,1,JAHEIRAJ
56499,Minsc,"Someone has rattled the little one's brains? Hmm, I know how she feels. If this was done on purpose, he deserves a mighty kick in his posterior at the least!",,1,MINSCJ
56508,Jaheira,"A mind flayer? Here? A spy perhaps, using its psionic powers to keep its secret. Strange that Jan's mad uncle should be aware of its presence.",,1,JAHEIRAJ
56514,Minsc,Helping others is good! What a nice little girl you are. Would you like to see my Boo? I think he approves of you too.,,1,MINSCJ
56515,Minsc,Helping others is good! What a nice little girl you are. Would you like to see my Boo? I think he approves of you too.,,1,MINSCJ
56516,Jaheira,"You speak as if unaware of class distinction, and yet your manner exudes it. A sign of immaturity... perhaps adventuring is not the place for you.",,1,JAHEIRAJ
56517,Jaheira,"You speak as if unaware of class distinction, and yet your manner exudes it. A sign of immaturity... good, then, that you is sending you ahead.",,1,JAHEIRAJ
56528,Jaheira,You dare reprimand those who have died defending you? Even now they strive to protect you from evil you don't even understand! You could have been dead!,,1,JAHEIRAJ
56551,Jaheira,"I have no fear for his well-being, monster.",,1,JAHEIRAJ
56599,Jaheira,"You have saved me, and I am in your debt once more. I am... I am glad you risked so much to come for me.",JAHEIRE8,1,JAHEIRAP
56617,Jaheira,"I see. Very well, I shall be on my guard. Do we continue now? There are more important things to do than sit here talking about things that... don't matter.",,1,JAHEIRAP
56625,Jaheira,Very well. Let's waste no more time.,,1,JAHEIRAP
56626,Jaheira,I... I would say as much about you. I will stand at your side as long as I am able... if you will have me there and return the favor.,,1,JAHEIRAP
56629,Jaheira,I shall enjoy some quiet time once this is done. We have had very little time to speak...,,1,JAHEIRAP
56630,Jaheira,"I'm sorry, I should not be so swept up in this. Let's go.",,1,JAHEIRAP
56675,Minsc,"I don't wish to alarm you, but Boo is absolutely fretting about your condition. Are you well? Fear in Boo is uncommon, and usually weasel-caused.",,1,MINSCJ
56679,Minsc,"We can rest if you wish. I do not understand what Irenicus did, but Boo has said that it was traumatic, and I will guard if we must stay here a while.",,1,MINSCJ
56680,Minsc,"That is good. I will guard if you need to rest. It is the least I can do, since I could not stop Irenicus.",,1,MINSCJ
56682,Minsc,"Then Minsc and Boo will turn their attentions to more important things, like staying alive. We should get moving if you are through with your headache.",,1,MINSCJ
56698,Imoen,"There's people dead all over, and the fighting is still going on. I could hear it. Are you going to get moving, or do I leave without you?",,1,IMOEN10
56877,Jaheira,"Where? Where exactly is it being put to good use? We are not to be played with, Linvail. I should like to see results, and I should like to see them soon.",,1,JAHEIRAJ
56881,Minsc,"Boo does not think so, despite your kind words. You smell of treachery. Prove me wrong or face the boot!",,1,MINSCJ
56886,Minsc,You'd have bought a trip to the graveyard if you had spent the money we needed to rescue Imoen! Minsc and Boo would see to that!,,1,MINSCJ
56899,Jaheira,"Oh, how generous. Do you expect that to compensate while you delay our more important concerns? We have friends in need of rescue and vengeance both!",,1,JAHEIRAJ
56906,Jaheira,And vengeance!,,1,JAHEIRAJ
57066,Jaheira,"I see. You must be the rogue, Jarlaxle, that was mentioned to us, yes?",,1,JAHEIRAJ
57396,Jaheira,"A poor thing. We could have done better by these people with minimal effort. It is a better fate than what the drow had in store, however.",,1,JAHEIRAJ
57455,Jaheira,"No. ""Veldrin"" would not be interested in such diversions, male. I... as a female, I command you to stand away from him. Slug.",,1,JAHEIRAJ
57740,Minsc,"When all others stand numb, it falls to Minsc and Boo to make comment. you...",,1,MINSCJ
57741,Minsc,Boo just soiled my backpack.,,1,MINSCJ
57901,Minsc,"Boo does not favor the odds, but I have no doubt we will succeed!",,1,MINSCJ
57903,Jaheira,"Yes, declare your loyalty, Viconia. When you eventually betray us, I will hold your statement up as proof of the untrustworthy nature of your kind.",,1,JAHEIRAJ
57905,Minsc,Boo would have sensed any treachery long ago! She fights well with us!,,1,MINSCJ
57911,Jaheira,"Cernd, I would normally bow to your wisdom, but in this matter, I think you are... mistaken. I make no protest; I merely wish to state my opinion.",,1,JAHEIRAJ
58056,IDRYAD3,May the forest always open a path for you!,,1,IDRYAD3
58132,Jaheira,"We are bought off yet again. I do not deny that they are the best chance we have to find our quarry, but we had best do their little chores quickly.",,1,JAHEIRAJ
58133,Jaheira,"Thank you for your opinion, Korgan. I'll just place it over here where it can collect flies all on its own.",,1,JAHEIRAJ
58137,Minsc,Boo concurs! We must hurry and dispense with this errandry so we can get to the fighting of greater evils more worthy of my bootprint!,,1,MINSCJ
58138,Minsc,"Minsc and Boo will protect your street, Aerie! You will cross it for your pleasure, not for fear of it!",,1,MINSCJ
58164,Jaheira,"You baffle me sometimes, Cernd, but I bow to your wisdom on this matter.",,1,JAHEIRAJ
58179,Minsc,Then let us get going! Boo and I have several talents we will unleash upon it!,,1,MINSCJ
58186,Jaheira,"Not just thieves, but traitorous thieves. Our associations sink ever lower in Aran's service. Let's get this over with.",,1,JAHEIRAJ
